{
  "schemaVersion": 1,
  "id": "border-nil-and-none-are-distinct",
  "claimType": "prose-requirement",
  "claim": "ST_Border carries two no-border tokens, nil and none, and a round trip must keep them apart.",
  "profiles": ["transitional"],
  "scope": {
    "feature": "reserved-values",
    "applications": []
  },
  "confidence": "provisional",
  "sources": [
    {
      "sourceId": "ecma-376-part-4-transitional",
      "locator": "wml.xsd simpleType ST_Border enumerates 193 members including both nil and none, verified in specifications/generated/docx-transitional-schema.gen.json"
    },
    {
      "sourceId": "ecma-376-part-1",
      "locator": "Part 1 17.18.2 ST_Border (clause unverified against the archive)"
    }
  ],
  "fixtures": [
    {
      "path": "specifications/evidence/fixtures/border-nil-and-none-are-distinct.xml",
      "assertion": "Saving the fragment writes w:val=\"none\" on the top border and w:val=\"nil\" on the bottom, not one token for both."
    }
  ]
}
