{
  "schemaVersion": 1,
  "id": "sectpr-type-absent-means-nextpage",
  "claimType": "prose-requirement",
  "claim": "A w:sectPr with no w:type starts the section on the next page: the element is optional and the omitted value means nextPage.",
  "profiles": ["transitional"],
  "scope": {
    "feature": "reserved-values",
    "applications": []
  },
  "confidence": "provisional",
  "sources": [
    {
      "sourceId": "ecma-376-part-4-transitional",
      "locator": "wml.xsd simpleType ST_SectionMark enumerates nextPage, nextColumn, continuous, evenPage, oddPage, and CT_SectType/@w:val records no default"
    },
    {
      "sourceId": "ecma-376-part-1",
      "locator": "Part 1 17.6.22 type (clause cited by the repository, not verified against the archive)"
    }
  ],
  "fixtures": [
    {
      "path": "specifications/evidence/fixtures/sectpr-type-absent-means-nextpage.xml",
      "assertion": "The second section begins on a new page, not continuously."
    }
  ]
}
