{
  "schemaVersion": 1,
  "id": "ind-hanging-wins-over-firstline",
  "claimType": "prose-requirement",
  "claim": "w:ind/@w:hanging and @w:firstLine are mutually exclusive; when both are present the hanging indent wins.",
  "profiles": ["transitional"],
  "scope": {
    "feature": "reserved-values",
    "applications": []
  },
  "confidence": "provisional",
  "sources": [
    {
      "sourceId": "ecma-376-part-4-transitional",
      "locator": "wml.xsd CT_Ind declares @w:firstLine and @w:hanging as independent optional attributes, so the exclusion is prose only"
    },
    {
      "sourceId": "ecma-376-part-1",
      "locator": "Part 1 17.3.1.12 ind (clause cited by the repository, not verified against the archive)"
    }
  ],
  "fixtures": [
    {
      "path": "specifications/evidence/fixtures/ind-hanging-wins-over-firstline.xml",
      "assertion": "The paragraph's first line starts 360 twips left of the body, not 720 twips right of it."
    }
  ]
}
